Job,Company,Location,Date of Post,Link
Desenvolvedor(a) Jr | Remoto,Plugaaê,"Florianópolis, Santa Catarina, Brazil",2023-11-01,https://br.linkedin.com/company/plugaae?trk=public_jobs_jserp-result_job-search-card-subtitle
"Pessoa Desenvolvedora de Software Front End - Junior
        
          (1 vaga)",TOTVS,"Joinville, Santa Catarina, Brazil",2023-11-21,https://br.linkedin.com/company/totvs?trk=public_jobs_jserp-result_job-search-card-subtitle
Desenvolvedor Front-End JR,Wareline,"Campinas, São Paulo, Brazil",2023-09-15,https://br.linkedin.com/company/wareline?trk=public_jobs_jserp-result_job-search-card-subtitle
Desenvolvedor Front-end Junior,"PSISEG - Psicologia, RH e SST",Greater São Paulo Area,2023-09-15,https://br.linkedin.com/company/psiseg?trk=public_jobs_jserp-result_job-search-card-subtitle
Desenvolvedor Front End Junior,RHEstratégia,"São Paulo, São Paulo, Brazil",2023-11-14,https://br.linkedin.com/company/rhestrategia?trk=public_jobs_jserp-result_job-search-card-subtitle
Desenvolvedor(a) Web,SERI.E DESIGN,"São Paulo, São Paulo, Brazil",2023-11-14,https://br.linkedin.com/company/seri.e-design?trk=public_jobs_jserp-result_job-search-card-subtitle
Programador Júnior,Unimed Vale do Sinos,"Novo Hamburgo, Rio Grande do Sul, Brazil",2023-08-05,https://br.linkedin.com/company/unimed-vale-do-sinos?trk=public_jobs_jserp-result_job-search-card-subtitle
Pessoa Desenvolvedora React Júnior,DB1 Group,"Maringá, Paraná, Brazil",2023-11-28,https://br.linkedin.com/company/db1-group?trk=public_jobs_jserp-result_job-search-card-subtitle
Desenvolvedor Full Stack Júnior,Grão Direto,"Uberaba, Minas Gerais, Brazil",2023-07-31,https://br.linkedin.com/company/graodireto?trk=public_jobs_jserp-result_job-search-card-subtitle
Programador Front end Júnior,Aqua Multitouch,"Belo Horizonte, Minas Gerais, Brazil",2023-10-27,https://br.linkedin.com/company/aqua-multitouch?trk=public_jobs_jserp-result_job-search-card-subtitle
Desenvolvedor Full Stack Júnior,TAGNA Technology,"Belo Horizonte, Minas Gerais, Brazil",2023-11-27,https://br.linkedin.com/company/tagnatecnologia?trk=public_jobs_jserp-result_job-search-card-subtitle
Estágio de Desenvolvedor(a) Web Fullstack ( C# e Angular),Viasoft Korp | Industry ERP,Brazil,2023-10-27,https://br.linkedin.com/company/viasoft-korp?trk=public_jobs_jserp-result_job-search-card-subtitle
Desenvolvedor Front end Junior,IVENTIS,"São Paulo, São Paulo, Brazil",2023-10-16,https://br.linkedin.com/company/iventis?trk=public_jobs_jserp-result_job-search-card-subtitle
Desenvolvedor (a) Web Júnior,Otimize,"Porto Alegre, Rio Grande do Sul, Brazil",2023-09-29,https://br.linkedin.com/company/otimizerh?trk=public_jobs_jserp-result_job-search-card-subtitle
Junior Software Engineer,MixRank,"Ituiutaba, Minas Gerais, Brazil",2023-11-13,https://www.linkedin.com/company/mixrank?trk=public_jobs_jserp-result_job-search-card-subtitle
Desenvolvedor Front-End,FuelTech,"Porto Alegre, Rio Grande do Sul, Brazil",2023-11-28,https://br.linkedin.com/company/fueltech?trk=public_jobs_jserp-result_job-search-card-subtitle
Junior Software Engineer,MixRank,"Ituiutaba, Minas Gerais, Brazil",2023-11-13,https://www.linkedin.com/company/mixrank?trk=public_jobs_jserp-result_job-search-card-subtitle
Pessoa Engenheira de Software Backend - Júnior,Elo7,Brazil,2023-11-11,https://br.linkedin.com/company/elo7?trk=public_jobs_jserp-result_job-search-card-subtitle
Desenvolvedor Java Fullstack Junior,Source2IT,"Barueri, São Paulo, Brazil",2023-11-28,https://br.linkedin.com/company/source2it?trk=public_jobs_jserp-result_job-search-card-subtitle
Desenvolvedor Front end Junior,IVENTIS,"Barueri, São Paulo, Brazil",2023-11-27,https://br.linkedin.com/company/iventis?trk=public_jobs_jserp-result_job-search-card-subtitle
Desenvolvedor Front End,RGK4IT,"Maringá, Paraná, Brazil",2023-11-24,https://br.linkedin.com/company/rgk4it?trk=public_jobs_jserp-result_job-search-card-subtitle
Desenvolvedor Back-end Junior,Ottimizza Sistemas Contábeis,"Joinville, Santa Catarina, Brazil",2023-11-06,https://br.linkedin.com/company/ottimizza?trk=public_jobs_jserp-result_job-search-card-subtitle
Programador(a) Full Stack Júnior,Íonz,"São Paulo, São Paulo, Brazil",2023-11-23,https://br.linkedin.com/company/-onz?trk=public_jobs_jserp-result_job-search-card-subtitle
Desenvolvedor(a) Javascript Júnior - Full Stack | Júnior,ProgramaThor,"São Paulo, São Paulo, Brazil",2023-11-14,https://br.linkedin.com/company/programathor?trk=public_jobs_jserp-result_job-search-card-subtitle
Pessoa Desenvolvedora Frontend l,Caffeine Army,"Salvador, Bahia, Brazil",2023-10-17,https://br.linkedin.com/company/caffeinearmy?trk=public_jobs_jserp-result_job-search-card-subtitle
